Speaker,Text,Annotation,Emotion
King Richard,Her life is safest only in her birth.,alert,supporting
Marcus Brutus,"Prepare the body then, and follow us",allow,supporting
Marcus Brutus,"Or else were this a savage spectacle. Our reasons are so full of good regard that were you, Antony, the son of Caesar, you should be satisfied.",assure,supporting
Mark Antony,"Let each man render me his bloody hand. First, Marcus Brutus, will I shake with you; Next Caius Cassius, do I take your hand; Now Decius Brutus, yours; now yours, Metellus; Yours, Cinna; and my valiant Casca, yours; Though last, not least in love, yours, good Trebonius.",capture,supporting
King Richard,"Madam, with all my heart",catch,supporting
Lady MacBeth,"When in swinish sleep their drenched natures lies, as in a death, What cannot you and I perform upon th'unguarded Duncan?",convince,supporting
King Richard,"Even all I have- ay, and myself and all. will I withal endow a child of thine; So in the Lethe of thy angry soul Thou drown the remembrance of those wrongs which thou supposest I have done to thee.",direct,supporting
King Richard,"Upto the dignity and height of fortune, the high imperial type of this earth's glory.",entangle,supporting
Marcus Brutus,"Only be patient till we have appeas’d The multitude, beside themselves with fear, And then we will deliver you the cause Why I, that did love Caesar when I struck him, Have thus proceeded.",appease,manipulating
Marcus Brutus,"You shall, Mark Antony.",appease,manipulating
King Richard,What do you think?,approach,manipulating
Mark Antony,"Gentlemen all—alas, what shall I say? My credit now stands on such slippery ground that one of two bad ways you must conceit me, Either a coward or a flatterer",beguile,manipulating
Mark Antony,"O, pardon me, thou bleeding piece of earth, that I am meek and gentle with these butchers!",beguile,manipulating
Marcus Brutus,"Mark Antony, here take you Caesar’s body. You shall not in your funeral speech blame us, But speak all good you can devise of Caesar, And say you do’t by our permission; Else shall you not have any hand at all About his funeral. And you shall speak In the same pulpit whereto I am going, After my speech is ended",control,manipulating
Phebe,"I’ll write to him a very taunting letter, And thou shalt bear it.",court,manipulating
Cassius,Your voice shall be as strong as any man’s. In the disposing of new dignities.,entice,manipulating
Phebe,"There be some women, Silvius, had they mark’d him In parcels as I did, would have gone near To fall in love with him; but for my part I love him not, nor hate him not; and yet Have more cause to hate him than to love him, For what had he to do to chide at me?",examine,manipulating
King Richard,"Lo, at their birth good stars were opposite.",manoeuvre,manipulating
Phebe,It is a pretty youth—not very pretty— But sure he’s proud—and yet his pride becomes him.,mask,manipulating
Mark Antony,"Therefore I took your hands, but was indeed Sway'd from the point, by looking down on Caesar. Friends am I with you all, and love you all, Upon this hope, that you shall give me reasons Why, and wherein, Caesar was dangerous.",play,manipulating
Mark Antony,Domestic fury and fierce civil strife Shall cumber all the parts of Italy;,shake,manipulating
Marcus Brutus,"By your pardon— I will myself into the pulpit first, And show the reason of our Caesar’s death. What Antony shall speak, I will protest He speaks by leave and by permission; And that we are contented Caesar shall Have all true rites and lawful ceremonies. It shall advantage more than do us wrong",calm,loving
Lady Macduff,"Ay, that he was",enlighten,loving
Lady Macduff,"Sirrah, your father's dead, and what will you do now? How will you live?",envelop,loving
Lady Macduff,"Now God help thee, poor monkey! But how wilt thou do for a father?",envelop,loving
King Richard,"You have a daughter called Elizabeth, virtuous and fair, royal and gracious.",lure,loving
Lady MacBeth,"They have made themselves, and that their fitness now. Does unmake you?",promise,loving
Lady MacBeth,"I have given suck, and know how tender 'tis to love the babe that milks me. I would, while it was smiling in my face, have plucked my nipple from his boneless gums, and dashed the brains out, had I so sworn. As you have done to this",seduce,loving
Lady MacBeth,"Who dares receive it other, as we shall make our griefs and clamour roar. Upon his death?",seduce,loving
Mark Antony,Be it so; I do desire no more.,soothe,loving
Marcus Brutus,"Though now we must appear bloody and cruel, as by our hands and this our present act. You see we do, yet see you but our hands. And this the bleeding business they have done.",stroke,loving
Lady Macduff,"What, with worms and flies?",tease,loving
Phebe,"Is his complexion; and faster than his tongue Did make offense, his eye did heal it up",woo,loving
Lady Macduff,He had none. His flight was madness.,challenge,harming
Lady MacBeth,"Know you not, he has?",challenge,harming
Queen Elizabeth,"Flatter my sorrow with report of it. Tell me, what state, what dignity, what honor. Canst thou demise to any child of mine?",challenge,harming
Queen Elizabeth,And wilt thou learn of me?,challenge,harming
King Richard,Who should be else,challenge,harming
Mark Antony,A curse shall light upon the limbs of men;,curse,harming
Queen Elizabeth,How canst thou woo her?,demean,harming
Queen Elizabeth,Unless thou couldst put on some other shape and not be Richard that hath done all this.,demean,harming
Queen Elizabeth,"So she may live unscarred of bleeding slaughter, I will confess she was not Edward's daughter.",sideswipe,harming
Queen Elizabeth,"To vail the title, as her mother doth.",slash,harming
Phebe,"He said mine eyes were black and my hair black, And, now I am rememb’red, scorn’d at me.",slash,harming
Phebe,But that’s all one; omittance is no quittance.,slash,harming
Phebe,"There was a pretty redness in his lip, a little riper and more lusty red than that mix’d in his cheek; ’twas just the difference betwixt the constant red and mingled damask.",strip,harming
Queen Elizabeth,"Be brief, lest that the process of thy kindness. Last longer telling than thy kindness' date.",swipe,harming
Lady MacBeth,He has almost supped.,warn,harming
Cassius,"Brutus, a word with you. You know not what you do. Do not consent that Antony speak in his funeral. Know you how much the people may be mov’d by that which he will utter?",warn,harming
Lady Macduff,"Wisdom? To leave his wife, to leave his babes,his mansion and his titles, in a place from whence himself does fly?",whip,harming
Mark Antony,Thou art the ruins of the noblest man that ever lived in the tide of times,acknowledge,encouraging
Lady MacBeth,"Wouldst thou have that. Which thou esteem'st the ornament of life and live a coward in thine own esteem. Letting 'I dare not', wait upon 'I would' like the poor car i'th'adage?",arouse,encouraging
Lady MacBeth,But screw your courage to the sticking place and we'll not fail,bolster,encouraging
King Richard,"Be not so hasty to confound my meaning. I mean, that with my soul I love thy daughter, and mean to make her queen of England.",coax,encouraging
Lady Macduff,"When our actions do not, our fears do make us traitors.",educate,encouraging
Lady Macduff,"Thou speak'st with all thy wit, and yet, i'faith, with wit enough for thee.",encourage,encouraging
Lady MacBeth,"When you durst do it, then you were a man. And to be more than what you were, you would be so much more the man.",encourage,encouraging
Queen Elizabeth,My daughter's mother thinks it with her soul.,induce,encouraging
Lady Macduff,"Why, I can buy me twenty at any market.",influence,encouraging
Phebe,I marvel why I answer’d not again.,move,encouraging
Lady MacBeth,"When Duncan is asleep, whereto the rather shall his day's hard journey. Soundly invite him, his two chamberlains. Will I with wine and wassail so convince, that memory, the warder of the brain shall be a fume, and the receipt of reason. A limbeck only",persuade,encouraging
Mark Antony,"That I did love thee, Caesar, O, ’tis true; If then thy spirit look upon us now, Shall it not grieve thee dearer than thy death. To see thy Antony making his peace, Shaking the bloody fingers of thy foes, Most noble! In the presence of thy corse? Had I as many eyes as thou hast wounds, Weeping as fast as they stream forth thy blood, It would become me better than to close In terms of friendship with thine enemies. Pardon me, Julius! Here wast thou bay’d, brave hart, Here didst thou fall, and here thy hunters stand, Sign’d in thy spoil, and crimson’d in thy lethe. O world! Thou wast the forest to this hart, And this indeed, O world, the heart of thee. How like a deer, strucken by many princes, Dost thou here lie!",persuade,encouraging
Cassius,"I know not what may fall, I like it not.",press,encouraging
King Richard,"Th'advancement of your children, gentle lady.",prod,encouraging
Phebe,When he that speaks them pleases those that hear.,pull,encouraging
Mark Antony,"That’s all I seek, And am, moreover, suitor that I may produce his body to the market-place, and in the pulpit, as becomes a friend, Speak in the order of his funeral.",push,encouraging
Phebe,But what care I for words?,push,encouraging
Marcus Brutus,"For your part, to you our swords have leaden points, Mark Antony. Our arms in strength of malice, and our hearts of brothers’ temper, do receive you in? With all kind love, good thoughts, and reverence",reassure,encouraging
Lady Macduff,How wilt thou do for a father?,teach,encouraging
Lady Macduff,why one that swears and lies,tutor,encouraging
Lady Macduff,"Every one that does so is a traitor, and must be hanged.",tutor,encouraging
Lady Macduff,"Why, the honest men.",tutor,encouraging
Mark Antony,"I know not, gentlemen, what you intend, who else must be let blood, who else is rank?",condemn,disturbing
Queen Elizabeth,I have no more sons of the royal blood for thee to slaughter.,confront,disturbing
King Richard,Even he that makes her queen.,contest,disturbing
Mark Antony,"If I myself, there is no hour so fit as Caesar's death's hour, nor no instrument of half that worth as those your swords, made rich with the most noble blood of all this world. I do beseech ye, if you bear me hard, now whilst your purpled hands do reek and smoke, fulfill your pleasure.",dare,disturbing
Mark Antony,"Live a thousand years, I shall not find myself so apt to die. I defy you no place will please me so, no mean of death. As here by Caesar, and by you cut off, the choice and master spirits of this age.",defy,disturbing
Queen Elizabeth,"Up to some scaffold, there to lose their heads.",deride,disturbing
Mark Antony,"Blood and destruction shall be so in use, and dreadful objects so familiar, that mothers shall but smile when they behold their infants quartered with the hands of war; All pity chok’d with custom of fell deeds;",frighten,disturbing
Queen Elizabeth,An honest tale speeds best being plainly told.,frustrate,disturbing
King Richard,"Stay, madam, I must talk a word with you.",grab,disturbing
Marcus Brutus,O Antony! Beg not your death of us.,grab,disturbing
Phebe,He’ll make a proper man,grab,disturbing
Lady Macduff,"What had he done, to make him fly the land?",interrogate,disturbing
Queen Elizabeth,But how long shall that title “ever” last?,interrogate,disturbing
Queen Elizabeth,But how long fairly shall her sweet life last?,interrogate,disturbing
Lady MacBeth,"And wakes it now, to look so green and pale. At what it did so freely?",poke,disturbing
King Richard,How think you of it?,poke,disturbing
Queen Elizabeth,"Well then, who dost thou mean shall be her king?",query,disturbing
Lady Macduff,"Poor bird, thou'dst never fear the net nor lime, the pitfall nor the gin.",question,disturbing
Lady MacBeth,Why have you left the chamber?,question,disturbing
Cassius,Mark Antony—,question,disturbing
Queen Elizabeth,"What good is cover&#8217;d with the face of heaven, to be discovered, that can do me good?",quiz,disturbing
Lady MacBeth,Was the hope drunk? wherein you dressed yourself? Hath it slept since?,shock,disturbing
Queen Elizabeth,"Slander myself as false to Edward's bed, throw over her the veil of infamy.",shock,disturbing
Mark Antony,"And Caesar’s spirit, ranging for revenge, with Ate by his side come hot from hell, shall in these confines with a monarch’s voice Cry “Havoc!” and let slip the dogs of war, that this foul deed shall smell above the earth with carrion men, groaning for burial.",terrify,disturbing
Cassius,"I blame you not for praising Caesar so, But what compact mean you to have with us? Will you be prick'd in number of our friends, Or shall we on, and not depend on you?",assess,discouraging
Lady Macduff,So runs against all reason.,block,discouraging
Lady Macduff,"Yes, he is dead.",block,discouraging
Lady Macduff,Every one.,block,discouraging
Lady MacBeth,We fail.,block,discouraging
Queen Elizabeth,There is no other way,block,discouraging
Queen Elizabeth,"But she, your subject, loathes such sovereignty.",block,discouraging
Queen Elizabeth,"O no, my reasons are too deep and dead. Too deep and dead, poor infants, in their graves.",block,discouraging
Lady MacBeth,What beast was't then. That made you break this enterprise to me?,chastise,discouraging
Queen Elizabeth,"For my daughters, Richard, they shall be praying nuns, not weeping queens and therefore level not to hit their lives.",deflect,discouraging
Marcus Brutus,"Welcome, Mark Antony!",disarm,discouraging
Queen Elizabeth,"And must she die for this? O, let her live! And I'll corrupt her manners, stain her beauty.",dissuade,discouraging
Marcus Brutus,"Our hearts you see not, they are pitiful. And pity to the general wrong of Rome. As fire drives out fire, so pity pity. Hath done this deed on Caesar.",divert,discouraging
Phebe,His leg is but so so—and yet ’tis well.,divert,discouraging
Queen Elizabeth,"What, thou?",halt,discouraging
Queen Elizabeth,As long as hell and Richard likes of it.,halt,discouraging
Queen Elizabeth,"Send to her, by the man that slew her brothers, A pair of bleeding hearts; thereon engrave “Edward” and “York.” Then haply she will weep.",mock,discouraging
Lady Macduff,"Father'd he is, and yet he's fatherless.",reject,discouraging
Queen Elizabeth,And only in that safety died her brothers.,reject,discouraging
Mark Antony,"O mighty Caesar! Dost thou lie so low? Are all thy conquests, glories, triumphs, spoils, shrunk to this little measure? Fare thee well!",reject,discouraging
Phebe,He is not very tall—yet for his years he’s tall.,resist,discouraging
King Richard,All unavoided is the doom of destiny,stir,discouraging
King Richard,Even so.,suppress,discouraging
Lady MacBeth,From this time such I account thy love.,threaten,discouraging
Mark Antony,Woe to the hand that shed this costly blood! Over thy wounds now do I prophesy (Which like dumb mouths do ope their ruby lips to beg the voice and utterance of my tongue),threaten,discouraging
Queen Elizabeth,"To save her life, I'll say she is not so.",thwart,discouraging
Queen Elizabeth,"No, to their lives ill friends were contrary.",stab,destroying
Phebe,’Tis but a peevish boy—yet he talks well,bluff,deceiving
Lady MacBeth,"What not put upon his spongy officers, who shall bear the guilt of our great quell?",entrap,deceiving
King Richard,"Madam, so thrive I in my enterprise and dangerous success of bloody wars. As I intend more good to you and yours than ever you and yours by me were harmed.",entrap,deceiving
Mark Antony,"Pardon me, Caius Cassius! The enemies of Caesar shall say this: Then, in a friend, it is cold modesty.",entrap,deceiving
Mark Antony,I doubt not of your wisdom,flatter,deceiving
Lady MacBeth,"Nor time nor place, did then adhere, and yet you would make both",remind,supporting
Queen Elizabeth,"Nay then indeed she cannot choose but hate thee, having bought love with such a bloody spoil.",reveal,supporting
King Richard,"That would I learn of you, as one being best acquainted with her humour",spurn,discouraging
Lady Macduff,He loves us not He wants the natural touch,strike,harming
King Richard,Know that from my soul I love thy daughter,strike,harming
Lady Macduff,"Poor prattler, how thou talk'st!",tickle,manipulating
King Richard,"Wrong not her birth, she is of royal blood.",tickle,manipulating
Phebe,"Wilt thou, Silvius?",wheedle,manipulating